{
  "schema_version": "reconstruction_plan_v1",
  "plan_id": "rp_reqdemo_psdreqde",
  "request_id": "req_demo",
  "decision_id": "psd_req_demo_1",
  "source_decision_type": "reconstruct",
  "plan_type": "revise_steps",
  "plan_status": "planned",
  "content_rewrite_allowed": false,
  "target_step_ids": ["step_002"],
  "planning_reason": "Po_self reconstruct decision requires planned revision of high-pressure semantic steps. Content is not rewritten.",
  "pressure_summary": {
    "max_priority_score": 7.5,
    "mean_priority_score": 7.25,
    "critical_count": 0,
    "viewer_feedback_count": 0,
    "max_viewer_pressure": 0.0,
    "trigger_type": "priority_threshold"
  },
  "planned_operations": [
    {
      "operation_id": "op_rp_reqdemo_psdreqde_001",
      "operation_type": "revise_step",
      "target_step_id": "step_002",
      "rationale": "Step step_002 was marked for future reconstruction by trigger 'priority_threshold'. Plan only; content is not rewritten in this PR.",
      "constraints": {
        "rewrite_allowed": false,
        "preserve_trace": true,
        "requires_future_executor": true
      }
    }
  ],
  "created_at": "2026-07-02T02:18:26Z",
  "trace_refs": [
    "evt_semantic_profile_001",
    "evt_po_self_decision_001"
  ],
  "viewer_feedback_refs": [],
  "notes": [
    "PR-006 plans reconstruction only; execution belongs to a future controlled reconstruction executor."
  ]
}
